Date,User,Fiabilite,Score,Texte
 11 septembre 2019,Bouclier Denis,Verifie,5,très intéressant pour comprendre son moi intérieur ainsi que l'origine des soucis que l'on se traine de génération en génération.
 13 septembre 2013,Lila,Verifie,3,"C'est un sujet super intéressant, mais je regrette de ne pas avoir acheté le livre plutôt. En général je prends les CD pour des sujets que je peux réécouter souvent, afin que l'information rentre bien. Mais le contenu de ce CD est trop superficiel pour que ça soit nécessaire de le réécouter, en deux trois fois je le connaîtrais par cœur et ça n'aura plus d'utilité. Je regrette de na pas avoir pris le livre car je pense que j'aurai trouvé plus de détails dedans, plus de profondeur."
 22 juil,PASCALE L,Verifie,5,Livre génial sur les blessures d'âme a lire en premier pour interpréter facilement les autres livres de Lise bourbeau j'ai beaucoup appris je recommande
 17 septembre 2020,Scaitty,Verifie,5,"recommandé apr une amie, un livre qui peut vous changer et changer votre vie...vraiment"
 15 août 2019,BB,Verifie,5,La base pour se comprendre et comprendre les autres. A compléter par « l'acceptation » De Lise Bourbeau pour concrétiser
 17 septembre 2020,Creep,Verifie,5,"Comme tout écrit, il ne faut pas prendre chaque mots pour vrais, mais ce livre m'a aider à développer des pistes pour évoluer et pardonner.... Ce n'est pas un livre miracle... Mais on y découvre des choses"
 4 décembre 2020,François B.,Verifie,4,Ouvrage fondamental que tout le monde devrait connaître pour pouvoir identifier ses problèmes psychologiques récurents. Mais il est prudent de ne pas trop s'identifier dramatiquement aux types décrits.
 7 novembre 2016,Johann K,Verifie,4,"C'est un livre intéressant et passionnant, à lire pour savoir pourquoi on agit de telle ou telle manière, on se retrouve facilement dans le livre (comportement, réaction etc...)"
 5 décembre 2019,Client d'Amazon,Verifie,5,Livre qui a faut son travail dans mon développement personnel. Tout y est!Rassurant de clarté. Je recommande
 4 janvier 2016,ND,Verifie,5,J aurais aimé connaître ce livre depuis longtemps. J ai appris beaucoup de choses sur moi même mais aussi sur mon entourage. J en parle beaucoup autour de moi et le recommande Vivement. Le prix est en plus très abordable.
 26 juil,Grégoire,Verifie,2,Bof... pas très intéressant... des raccourcis et des idées reçues qui n'apportent rien et réduisent beaucoup trop les relations humaines.
 19 juil,Luc Boutet.,Verifie,1,"Ce bouquin, acheté pour écrire un article sur une masseuse-sophrologue (elle avait fait un stage, chez Lise Bourbeau). Pour remplacer le Témestat : c'est idéal ! Je me suis endormi en 5 minutes. Sauf si vous êtres très intéressé par le sujet, vous pouvez vous abstenir !"
 19 décembre 2018,Client d'Amazon,Verifie,1,"Vraiment déçue, c'est un livre numérique alors que je pensais que c'était un livre papier.... J'aimerais bien être remboursée"
 3 octobre 2020,Mathiau,Verifie,2,Je n'est pas du tous accrocher avec ce livre. Mais sa ne tien que de mon avis
 21 novembre 2020,Juliette m,Verifie,4,"Tres bon livre de développement personnel. Si vous voulez n'en lire qu'un seul,lisez celui-là.  Un peu cher tout de même"
 6 novembre 2015,Buzy,Verifie,3,"Trouver les origines de notre mal-être est un vrai défi.Quelques pistes de réflexion intéressantes sont fournies ici.Mais démêler objectivement nos attitudes et nos comportements reste difficile.En ce qui me concerne, les descriptions physiques du corps ne me permettent pas de déceler une tendance plutôt qu'une autre.Et ce n'est certes pas parce que je serais exempte de tous symptômes..."
 5 janvier 2020,Client d'Amazon,Verifie,5,Un livre qu'il faut apprécier et lire par petites doses. Il demande une certaine concentration et une connaissance de soi. Très intéressant.
 15 juin 2017,Sissou26790,Verifie,5,je recommande ce livre à chacun d'entre nous car nous sommes tous concernés. En plus petit format donc on peut l’emmener partout avec soi
 1 août 2020,Capucine lorenzo,Verifie,5,"livre qui peut bouleverser une vie, et les relations familiales. A lire absolument !"
 22 février 2021,Flora Martins,Verifie,4,Livre qui fait beaucoup réfléchir et vraiment pas mal mais étant en derniere année de licence de psycho je remet pas mal en question la fiabilité de certaine informations (l'autrice n'est pas de plus pas psychologue ou chercheuse en psychologie) . Mais sinon très bon pour la remise en question et très intéressant
 18 septembre 2018,Sophie ARGENCE,Verifie,5,Dans la série des livres de Lise BOURBEAU celui-ci est assez exceptionnel
 18 mai 2019,Follerot Olivier,Verifie,5,La lecture de ce livre est indispensable à qui souhaite progresser dans sa compréhension de l'autre et de sa propre personne.
 8 février 2019,Client d'Amazon,Verifie,5,Tout le monde devrait avoir ce bouquin!! Tellement bouleversant et VRAI!! Incroyablement bluffant! C'est auteur connaît si bien ma vie?!! c'en est flippant
 31 mars 2021,Client d'Amazon,Verifie,1,"Meilleures ventes dans #personnages scientifiques!!!=>Même l'auteur indique dans les 1ere page que ce n'est pas le cas.Pour apprécier ce livre il faut croire en la vie après la mort, la réincarnation ou que toutes les personnes ayant la même physionomie rencontre les mêmes difficultés dans la vie."
 30 décembre 2020,Carole,Verifie,5,Réception dans les tempsCorrespond aux attentesLivre très intéressantJe l ai acheté pour plusieurs personnesA lire régulièrement ou durant des périodes de vieRemets en question où permet d en apprendre plus sur soi ou sur son entouragePermet également de mieux comprendre les différents comportements .....
 5 octobre 2012,MGEROC,Verifie,4,"L'introduction m'a profondément ennuyé.  De plus, chacun appréciera selon ses propres convictions des affirmations telles que : ""Avant même de naître, ton DIEU intérieur attire ton âme vers l'environnement et la famille dont tu auras besoin dans ta prochaine vie"".  Je donne néanmoins 4 étoiles à ce livre parce que les chapitres qui décrivent les blessures fondamentales valent de l'or. Le modèle proposé est bien détaillé, suffisamment universel et accessible. Ce livre nous aide à comprendre les principaux masques mis en place pour s'adapter aux blessures de la vie. Les replacer de le contexte de l'enfance et de ses fragilités facilite grandement cette compréhension, et même l'acceptation."
 27 décembre 2018,Laurent,Verifie,5,Fan de l auteure. A lire ainsi que le livre sur l acceptation. Ai conseillé dans mon entourage.  A changé la vie de façon très positif de certaines connaissances. Souvent une révélation.
 16 juin 2019,isabelle,Verifie,5,"formidable, pour le reste lisez le il est top et se lit très facilement."
 9 avril 2018,Océane,Verifie,4,"Ça fait un moment que je voulais l'acheter car j'en ai entendu énormément parler, j'ai enfin sauté le pas, très contente de ce livre. De plus il a été livré très rapidement ! Bon petit bémol une page était plié à son arrivé mais pas grand chose et c'était une page vierge donc pas gênant."
 20 octobre 2019,Pat,Verifie,5,Ce livre a changé ma relation à mes parents et m'a apaisée. J'ai plus vite progressé à sa lecture sur ce sujet qu'en 10 ans de psychothérapie
 3 août 2020,Stéphanie Ancrenaz,Verifie,5,"Livre top. Je l’ai lu en une vitesse record! Et mon copain aussi, on en a appris beaucoup."
 22 février 2020,agnes filippi,Verifie,5,Les cinq blessures qui empêchent d'être soi-même à lire
 6 avril 2020,Jossier Nicolas,Verifie,1,Un vrai torchon. Si vous allez vraiment mal gardez vos sous pour une vraie thérapie. Ce genre de lectures sèmera encore plus le doute dans votre esprit. On frôle le viol intellectuel.
 29 septembre 2019,Julie Méjard,Verifie,5,Livre que l'on m'a conseillé et vraiment j'ai bien fait de le suivre
 27 mars 2021,Bérengère,Verifie,5,"Un livre vraiment bien, qui pousse à la réflexion sur son psychisme ! Très facile à lire"
 30 octobre 2020,Carbonne,Verifie,5,J’adore le lire à voir les autres chapitre c’est vraiment intéressent et trés psycologique
 8 novembre 2019,Client d'Amazon,Verifie,5,Beau livre développement personnel Outil de guérison
 22 avril 2019,Catherine P.,Verifie,5,"Pour ceux qui travaillent leur développement personnel, ce livre vous apportera beaucoup de réponses"
 27 novembre 2020,Amazon Customer,Verifie,5,"Une pépite pour les amateurs de développement personnel !Personnellement j'ai beaucoup changé (en bien) depuis ma lecture, il me permet de prendre du recul et de mieux analyser les situations. Depuis je l'ai beaucoup offert à mes proches."
 29 août 2019,Audrey,Verifie,3,"le livre en soi est pas mal, vraiment il décrit tout ce dont nos blessures nous menent tout au long de notre vie, on arrive à connaître approximativement nos blessures. Cependant le seul bémol c'est qu'il peut être un peu redondant à la longue."
 18 septembre 2020,Client d'Amazon,Verifie,5,Livre très intéressant pour travailler sur soi. À recommander 👍
 6 juil,lana,Verifie,4,"par curiosité j ai acheté ce livre je ne suis pas déçue , il se lit facilement permet de comprendre mieux certaines choses, de voir différemment même si je ne suis pas d accord avec tout, je trouve que c est un livre intéressant et je le recommande"
 12 octobre 2019,clôdine,Verifie,4,livre  offert à une amie je ne peux en dire +
 30 octobre 2019,hanteville fabien,Verifie,5,Livraison rapide et conforme à la description
 5 mars 2019,oceane450,Verifie,5,Livre très intéressant. Je recommande vivement
 14 avril 2019,val,Verifie,5,Etonnant et super
 12 janvier 2018,baloubadu13,Verifie,5,"Un livre accessible et facile à lire qui décrit parfaitement les 5 blessures au travers d exemples.Un tout petit chapitre pour les pistes de guérison, juste de quoi donner envie d acheter le livre d après ;-)"
 14 septembre 2019,SandieMissdidou,Verifie,2,Pas mal mais fatiguant de lire ce qui ne nous concerne pas.
 1 avril 2016,MICHEL M,Verifie,5,"Une découverte, une révélation, beaucoup de psychologie et de réconfort dans ce livre positif qui s'attache à comprendre sans jamais juger, qui fait appel à l'intelligence et les ressources propres à chacun. Utile voire indispensable."
 5 août 2019,le page,Verifie,5,"Un voisin impressionnant, même un peu flippant tellement on se reconnaît ainsi que nos proches !!! Maintenant au boulot pour réparer tt cela !"
 4 février 2020,MarieLaure,Verifie,2,Un classique facile à lireMais bon il y a des redondances et des choses un peu tirées par les cheveux
 18 novembre 2017,AUDREY YSERD,Verifie,4,"bon livre, facile et rapide à lireon y apprends des éléments intéressants et permet d'appliquer des choses au quotidien"
 20 mai 2019,MARIOTTE,Verifie,5,"Livre reçu dans les délais, à lire pour se connaître et identifier son moi"
 8 août 2019,hoarau,Verifie,5,"ce livre m'a été recommandé, je ne l'ai pas encore lu pour le moment. en très bon état"
 7 mars 2020,Client d'Amazo,Verifie,4,"Très bon livre, offert à des amies"
 24 décembre 2015,Elinor Hurst,Verifie,5,"Les 5 blessures de l'âme et leurs ""masques"" correspondants décrits avec toute la maîtrise et l'expérience que l'on sent chez l'auteur. Livre facile à lire, sans détour et très riche à destination de tout un chacun."
 22 septembre 2020,Cush Justina,Verifie,1,A éviter à tout prix.  C'est la première fois de ma vie que je mets un livre à la poubelle (recyclage) - pourvu qu'il ne revient pas dans une autre vie!
 26 mai 2019,Elodie,Verifie,3,Bon livre pour savoir de quels blessures nous empêche d'être nous même.Un peu sceptique par rapport au lien que l'auteur fait avec le physique.
 31 mars 2014,MICHELLE,Verifie,5,"Ce livre a été une vraie révélation pour moi, il a pu mettre les points sur les i, il a répondu à beaucoup de mes questions existentielles.A lire et relire pour se remettre en question et mieux comprendre qui nous sommes avec nos blessures et quels sont nos comportements et ceux des autres suite à ces blessures.Merci Lise Bourbeau pour ce livre magnifique, précis et très explicite avec beaucoup d'exemples où chacun peut se retrouver et mieux comprendre les autres. Mais aussi il apporte une clé pour améliorer nos vies, nos comportements et nos relations afin d'aller au delà de nos blessures."
 28 juin 2017,Emy Abracadabra,Verifie,5,Une lecture incroyable qui m'a aidé a me connaître et reconnaître. Un libre que je recommande de lire absolument a tout le monde a tel point c'est un trésor!! Merci Lise pour cela!!!
 24 mars 2021,Maria Massolo,Verifie,5,Excellentissime ! Tout est tellement vrai et colle à la réalité
 1 mars 2020,Client d'Amazon,Verifie,5,aussi bien qu'en librairie.le plus : livré à la maison
 13 août 2020,Bacbac,Verifie,5,Livre très intéressant qui mérite d'être partagé.Livraison rapide et conforme aux prévisions
 19 mars 2017,marie-guymère GROS-DESORMEAUX,Verifie,4,"Un livre  pour se découvrir.  Et très  intéressant à étudier.  A relire et à partager, je  vous le recommande su vous posez des questions  sur certaines  de vos réactions"
 13 novembre 2020,La lecture au fil de l eau,Verifie,5,Ce livre remue nos blessures mais nous aide a les guérir. A lire absolument
 25 décembre 2020,Client d'Amazon,Verifie,2,J ai acheté ce livre par curiosité mais je ne me suis absolument pas retrouver dedans. Je n adhère pas
 29 juin 2019,Client d'Amazon,Verifie,5,"Ce livre m'a aidé à me trouver ,mieux comprendre les autres!"
 9 août 2017,Client d'Amazon,Verifie,5,"Livre très intéressant . Il donne des informations qui nous aident pour comprendre, accepter nos blessures. Le dernier chapitre donne  des clés  pour les surmonter."
 22 août 2020,poucet,Verifie,5,"Ce livre m à été conseillé par plusieurs personnes de mon entourage. Je l’ai lu en deux jours et je ne peux que le conseiller à tout le monde les yeux fermés, ce livre est une véritable pépite."
 2 juil,Camille b,Verifie,2,très caricaturé et y a pas les solutions
 2 février 2021,Maxence Mulliez,Verifie,4,"Rien à redire, très sympa"
 16 avril 2019,Client d'Amazon,Verifie,5,indispensable. même si mal organisé
 7 mai 2018,Catimini,Verifie,4,L'auteur présente un point de vue intéressant et qui permet de réfléchir à soi et aux autres en se décalant de nos visions habituelles. Cela mérite d'être lu!
 28 octobre 2020,CéC,Verifie,5,"Très intéressant, ce livre m’a bcp plu, je le conseille"
 10 octobre 2019,AF,Verifie,5,Très bon livre : simple et sérieux
 5 janvier 2019,Marchand,Verifie,5,Livre à lire et relire
 4 novembre 2020,Maza,Verifie,5,"J ai bien reçu le livre, maintenant y a plus qu'à le lire"
 25 août 2020,Marie,Verifie,5,Bon livre de poche
 2 février 2018,MARTINE V.,Verifie,5,Très bel ouvrage à lire en premier pour comprendre les autres du même auteur.Je l’ai lu et relu pour m’en imprégner... impressionnant ! Merci Lise !!
 15 mars 2021,Client d'Amazon,Verifie,4,Très bel ouvrage
 12 juin 2019,Estelle,Verifie,5,"Excellent livre de développement personnel. Écriture simple, fluide et très compréhensive. Un Basic à lire impérativement."
 20 juil,PULISCIANO ISABELLE,Verifie,3,"J'ai eu envie de lire ce livre après avoir entendu une thérapeute / conférencière formée par Lise BOURBEAU y faire référence et je n 'en suis pas déçue, au contraire.L'auteur va droit à l'essentiel sans se perdre en détails inutiles, agréable à lire et formateur en ce qui me concerne.Bon achat que je conseille à qui serait tenté"
 28 novembre 2020,Thepurelazydog,Verifie,5,Très bon rapport qualité/prix.
 24 juin 2017,Isa,Verifie,5,"Je l'ai d'abord lu moi, et j'ai adoré. Je l'ai offert à ma mère qui est thérapeute Gestalte et elle l'a dévoré. Une belle manière de parler de corps, de lignées familiales, de blessures et de guérisons."
 29 septembre 2020,Bellatris,Verifie,3,"Très bon livre, permet de comprendre ses blessures et comportements et ceux de son entourage. Seul bémol, pas d'aide pour en guérir. Il vaut peut-être mieux acheter ""Guérir de ses blessures"" directement si le but est de les guérir."
 18 octobre 2020,Isabelle Bittante,Verifie,5,Très bien
 2 mars 2018,Yza bzh,Verifie,5,Un livre de référence a lire et a relire absolument. Ouvrage facile a lire et en format poche . top
 8 septembre 2019,Merouze,Verifie,4,Bon livre
 12 novembre 2020,Guy Vandenthoren,Verifie,5,Conforme
 12 janvier 2020,Lisa RODRIGUEZ,Verifie,5,"J'adore ce livre il est très bien  pour débuter une introspection, pour identifier L ego et donc nous permettre d'être qui on est vraiment et d'être plus libre"
 29 mars 2021,Client d'Amazon,Verifie,5,Parfait
 13 octobre 2019,Faby,Verifie,5,A lire absolument ! Je le recommande vivement !
 28 octobre 2015,Laure,Verifie,5,Un merveilleux ouvrage que ce petit livre pour prendre conscience de tout ce qu'on a pu enfermer en soi et entamer le processus de guérison pour une vie livre et de plus en plus heureuse ! Merci Lise Bourbeau
 6 novembre 2017,Emilie,Verifie,5,"Livre incontournable pour les personnes cherchant à faire un travail personnel sur les blessure du passé, expliqué de manière simple et complète"
 6 janvier 2020,hatoria,Verifie,5,merci
 5 septembre 2015,Dakini,Verifie,2,"Je n'ai pas pu dépasser le deuxième chapitre, malgré tout l'intérêt du sujet et mes multiples tentatives, tant c'est mal écrit. C'est du canadien, je crois ? Pas d'effort d'adaptation en français ?Dommage..."
 23 juin 2020,Emilie,Verifie,5,J'ai beaucoup aimé ce livre
 24 novembre 2019,client amazon,Verifie,5,A lire  ! cela m'a bouleversé et je pense que je vais le relire !Merci pour cette ouverture sur la connaissance de soi.
 6 décembre 2020,Alisone G.,Verifie,5,Top
 1 février 2014,padvibe,Verifie,5,"bizarrement, pour une classification psychologique en seulement 5 catégories, c'est très bien observé et très finbien sûr, ce repérage n'est pas une fin en soi, ce livre ne peut remplacer une méthode pour dépasser ses blessures (bouddhisme, oponopono ou autres, selon les appétences culturelles)mais il peut constituer une étape importante dans la connaissance de soi"
 1 août 2019,Client d'Amazon,Verifie,5,Ce livre m’a bouleversé ... je recommande
 1 novembre 2017,Asmaa Soussi Lapouge,Verifie,5,"Une lecture qui vas vous étonner. Connue par le billet d'un article sur le Web, j'ai rapidement commandé le livre pour en connaître plus sur moi même, mes blessures et puis pour essayer de trouver des pistes de guérison. Vous allez adorer l'offrir à vos proches."
 19 janvier 2021,Mistherieuse,Verifie,5,Bien
 6 novembre 2019,Amazon clientèle,Verifie,2,franchement j'ai acheté ce livre parce que beaucoup disait qu'il était super etc mais moi j'ai pas accroché plus que ça .
 28 janvier 2019,pre,Verifie,5,je l ai lu super interesant
 19 avril 2020,Sejalon e.,Verifie,5,Super livre. Reçu en bon état et en délais rapide.
 25 janvier 2020,Claudia BROUTIN,Verifie,3,Bien
 20 juin 2019,marie baratte,Verifie,5,On apprend beaucoup sur soi et les autres...
 31 juil,Monique67,Verifie,3,"intéressant, si on aime l'approche de Lise Bourbeau (écoute ton corps, etc ...) personnellement j'ai eu du mal à m'y accrocher, je ne me suis pas reconnue entièrement dans une des blessures, plutôt un mélange, et alors le portrait physique ne colle pas !"
 21 août 2020,Khaoui,Verifie,5,Superbe livre !
 4 novembre 2013,Anita Angeli,Verifie,5,"Extrêmement intéressant pour qui est prêt à faire un long chemin en développement personnel. Les explications sont claires et bien présentées, avec des propositions de travail individuel. Peut-être quelques outils plus concrets seraient souhaitables. Le produit a été livré dans les délais prévus, avec un emballage parfaitement adapté."
 24 décembre 2020,chris75,Verifie,2,Ras
 26 avril 2019,Angelica Amane,Verifie,4,Intéressant
 13 août 2019,Client d&#39;Amazon,Verifie,5,Tres bon livre
 16 octobre 2014,Caro11,Verifie,5,"Livre facile à lire, où l'auteur tutoie le lecteur (un peu bizarre au début!)Facile à comprendre aussi, bien expliqué, quand on observe les personnes autour de soi on peut s'amuser à repérer les types de blessures (apparence) et de masques (comportement). Bref UTILE quand on s'intéresse à l'Homme !"
 2 janvier 2020,samuel,Verifie,4,"Très bon livre, cependant, il faut accepter de s’identifier et d’être une ou deux des 5 blessures... attention quand même. Ne pas lire le soir."
 8 novembre 2020,Benjamin mousset,Verifie,1,"Un livre dont je n'ai même pas pu dépasser la 10eme page tellement les explications sont superficielles, ésotériques, et ne reposent sur aucune experience scientifique ni même psychologique. A fuir"
 27 février 2014,schnackala,Verifie,5,"A LIRE ET RELIREun livre qui nous apprend beaucoup de choses sur nous, nos reactions face a des blessures, des comportements automatiques eloignés de notre vrai ""moi"", que du bonheur si on souhaite deposer nos valises du pasé qui nous empechent d'avancer librement....je conseil fortement ce livre, il m'a beaucoup aidé !"
 5 septembre 2019,Bouzid,Verifie,5,A lire
 11 décembre 2019,Nina,Verifie,5,"livre reçu le lendemain, contente de mon achat."
 6 avril 2018,Feel cocotier YT,Verifie,3,assez bon livre mais ne ma pas aider plus que cela ... dommage je n'ai pas réussi a le terminer pourtant j'étais assez enthousiaste a l'idée de le lire
 24 juin 2013,louloutte26,Verifie,5,"c'est un livre tres bien expliqué et tres interessant pour mieux se comprendre et comprendre les autres...je le recommande à tout le monde,jeune ou moins jeune qui en ont marre de ce monde qui si on ecoute tout le monde autour de nous part en vrille, et si tout ça venait de nous tous ceci,nous y compris....."
 13 mars 2013,Framboisem,Verifie,5,"J'ai adoré ce livre conseillé par un coach en développement personnel. Chaque chapitre est bien détaillé et l'on arrive à se retrouver soi même et nos proches et ainsi comprendre un peu mieux les blessures, donc les réactions de chacun.Je l'ai offert à ma belle soeur et conseillée à 2 amiesOn peut aussi en complément lire LES 4 ACCORDS TOLTEQUES"
 7 septembre 2019,Client d'Amazon,Verifie,4,Ma femme m’a dit que c’est un très bon livre
 5 août 2019,Nath,Verifie,5,Super livre
 12 septembre 2019,Client d'Amazon,Verifie,5,Bon produit
 20 mars 2018,Galloune,Verifie,5,"Un livre utile et intéressant pour se connaître et apprendre à comprendre les autres, avec leurs blessures et leurs différences"
 17 mars 2019,annjoy,Verifie,5,Excellent livre qui m'a beaucoup aidé à comprendre le pourquoi des comportements ... aussi bien pour moi-même que pour mes enfants. Je l'ai déjà offert à plusieurs amis
 15 juil,A. Gandolfi,Verifie,5,"Superbe ouvrage, un gros travail de la part de l'auteure.Il faut être prêt à se remettre en question lorsqu'on le lit. Mais le jeu en  vaut la chandelle, une fois libéré de nos blessures on peut enfin être nous-même"
 4 juin 2015,GUERIN,Verifie,5,"Livre à lire pour mieux comprendre la psychologie humaine et ses blessures qui marquent des vies entières ...L' auteur, de part sa façon de s' adresser au lecteur n' est pas commune mais son analyse de l' humain est très pertinente ..."
 8 octobre 2018,alextrem,Verifie,5,Le livre est arrivée en bonne etat.Celui ci est agréable a lire et son contenu est plutot complet.J'aurais aimé une partie pour corrigé les problemes.
 5 janvier 2020,muller,Verifie,5,À lire et à méditer excellent livre
 25 octobre 2014,Oriane  Bernard           ou   Idia Legray,Verifie,3,"Je ne peux pas dire que c'est parfait, mais en le lisant vous trouvez une ou des petites choses qui vous ont marqués, je l'ai prètéet serait contente de savoir ce que cette personne pense.Cela fait quand même réfléchir et c'est tant mieux.Oriane"
 26 août 2018,Client d'Amazon,Verifie,5,"Ce livre m’a été conseillé par une amie , je l’ai lu en 48h et ça permet de se connaître de realiser qu’on a des blessures qui nous empêchent d’avancer de se sentir bien ."
 27 mars 2020,Client d'Amazon,Verifie,3,"Adepte des livres sur le développement personnel, je n’ai tout simplement pas accroché avec la vision de l’auteur.Beaucoup de répétitions.Le rapport à la nourriture me laisse perplexe.Cette lecture n’était tout simplement pas faite pour moi!"
 15 août 2018,Mamili,Verifie,5,A lire de tout urgence. Avec calme et lucidité pour enfin comprendre ce qui cloche parfois sans que l'on sache pourquoi.
 12 juil,Car Ô Line,Verifie,5,"Livre qui secoue, mais qui rempli, pour moi, ses objectifs !Je pense qu'il doit être lu par tous et toutes :o)"
 4 mars 2020,Mina,Verifie,5,A lire au moins une fois
 18 août 2019,Polma,Verifie,1,Indisplnible
 1 août 2019,FAURE MONIQUE,Verifie,5,instruction personnelle.m'a beaucoup aider à mieux me comprendre
 4 avril 2021,Céline,Verifie,3,abordable
 6 octobre 2019,Colmard,Verifie,5,Prendre conscience de sois même réflection bien
 20 juin 2018,Romain,Verifie,1,"Je ne met qu'une seul étoile.Plein d ésotérisme, des pseudo vérités .Je n ai  tout aimé ce livre"
 8 février 2016,Client d'Amazon,Verifie,4,"Bien que je n'adhère pas à l'ensemble des théories du livre, une fois qu'on a fait le tri, il regorge d'éléments tout de même pertinents, et aide beaucoup à ""laisser aller"" certains sentiments / évènements qui nous polluent l'existence.Je recommande vraiment ce livre, qui aide vraiment lorsqu'on est sur le chemin de la paix intérieure :)"
