Date,User,Fiabilite,Score,Texte
 23 septembre 2015,A De Thierens,Verifie,1,"Inutile, j'aurai dû faire confiance aux avis 1 *.Bref, gaspillage d'argent, rien de concret dans cet ouvrage,  cela reste insipide avec les mêmes répétitions qui ne mènent à rien.  Dommage."
 25 juin 2013,Puce,Verifie,2,"un peu tiré par les cheveux..... globalement des notions très intéressantes mais une rédaction très difficile à suivre, soporifique et surtout.....je hais le tutoiement utilisé dans la rédaction"
 27 avril 2015,athéna,Verifie,1,"j avais de grandes attentes pour cette ouvrage mais j ai été très déçue, je n'adhère pas du tout à son approche du sujet et je trouve ces conclusions pas crédibles du tout ...!"
 10 octobre 2017,jean-françois le meut,Verifie,1,"Vérification faite, il semble bien que ce bouquin soit édité par une entreprise soupçonnée par la Mivilud et au Canada de déviance sectaire. Poubelle..."
 30 mai 2014,Laurent 69,Verifie,2,Les références à la réincarnation m'ont surpris. Je m'attendais à des explications plus scientifiques.Certaines descriptions des comportements ainsi que les raisons qui déclenchent ces comportements sont intéressantes.
 14 décembre 2015,Isa C.,Verifie,5,"Je lis régulièrement des livres de développement personnel. Celui-ci est vraiment génial. Je pense même que c'est le livre qui m'en a appris le plus sur moi-même et sur les autres.J'aurais pu être sceptique quant au rapport ""caractéristiques physiques"" et ""blessures"", mais non. Je pense réellement désormais que notre apparence physique est le reflet de nos blessures (et donc de notre personnalité).En bref, un livre qui vaut vraiment, vraiment le coup d'être lu si vous voulez en savoir plus sur vous-même ou pour mieux comprendre les autres. Je n'ai pas forcément cru tout ce que l'auteur explique (notamment le fait que l'on se réincarne, je n'ai pas cette croyance là), mais comme tout livre de développement personnel, il suffit de faire un petit tri dans les informations pour prendre seulement ce qui nous intéresse (et honnêtement, je n'ai quasiment rien à ""jeter"" dans ce livre).Vraiment, n'hésitez pas, lisez-le !"
 3 juin 2007,Mike,Verifie,4,"Certains d'entre vous ont peut-être déjà lu que ""tout se jouait avant l'âge de 6 ans""Nous naissons au monde et prenons rapidement conscience de notre propre identité (car le nouveau né commence juste à faire la différence entre lui et la mère). C'est avant 6 ans que tout se joue complexe d'Oedipe, etc. ...)L'auteure présente très clairement 5 blessures que nous développons avant l'âge de 6 ans.Nous voyons le monde/des problèmes/des solutions à travers au moins une blessure que nous avons développée et qui sont expliquées par un chapitre chacune. Ces blessures sont sources de qualités qui nous rendent unique et plein de valeur.J'ai acheté ce livre il y a 1 an et demi.Certains lecteurs jugent négativement les rares théories sur la réincarnation alors qu'elles sont rares et n'occupent que quelques paragraphes du livre.(l'idée est ici de dire qu'on a inconsciemment choisi sa vie et décider de revivre certaines choses/problèmes qu'on a pas réussi à régler dans une vie antérieure).Franchement, que vous croyiez ou non à ces théories ne changera pas grand chose à ce que ce livre pourra vous apporter. L'essentiel n'est pas là !L'essentiel, c'est une l'approche aux blessures psychologique de notre personne.Il y a 5 blessures. Le livre est facile à comprendre et à la portée de tous. Vous apprendrez à découvrir votre ou vos blessures et les mécanismes de protection que vous avez mis en place.Je trouve que ce livre est un vrai cadeau pour celui qui commence une démarche de recherche et d'épanouissement personnel.Ensuite, si comme moi vous avez apprécié cette approche personnalisée par blessure (qui est géniale pour dégrossir le terrain), alors vous pourrez vous tourner vers d'autres livres plus facile à comprendre après avoir lu celui-ci, tel ceux traitant de l'Ennéagramme (9 blessures). (j'ai aussi fait un commentaire sur l'un d'entre eux si vous regardez le lien ""tous mes commentaires à droite de mon pseudo ;-)"
 14 janvier 2016,cordydoyle2012,Verifie,1,Je n'ai pas accroché et ai même fini par le revendre. Ca nengage que moi bien évidement. Moi il ne pas aider jai préfèré d'autres ouvrages sur le même thème
 8 décembre 2016,MARIA,Verifie,1,"Le livre des 5 blessures qui empêchent d’être soi-même me semble très subjectif, il manque de scientifique, pas envie de le finir..."
 6 juil,Géraldine J.,Verifie,5,"Un livre à lire!!!! Très surprenant, on y apprend beaucoup sur soi-même et sur les autres. J ai adoré et je conseille vivement"
 24 octobre 2016,ZEBRE,Verifie,1,"J'apprécie de lire... un peu tout. Romans, livre psy, philo, classiques, BD, etc. Mais là, carrément pas. Je n'ai pas réussi à tout lire, trop dirigiste. Tout n'est pas à jeter mais franchement le peu de bien se retrouve dans tellement d'autres bons ouvrages. Cette affirmation ""d'apparence physique"" liée à une personnalité, ça s'adresse à des personnes qui n'ont aucune expérience de la vie et qui sont prêtes à donner de l'importance à toutes les légendes urbaines. Et dès la première page, cette conviction de réincarnation choisie exprès dans des conditions toxiques jusqu'à ce que nous ayons soigné nos blessures, j'ai failli fermer ce livre pourtant chaudement recommandé dès sa couverture.Franchement, personnes intelligentes et ouvertes, passez votre chemin à moins de chercher l'ennui ou l'ironie..."
 28 décembre 2015,Client d'Amazon,Verifie,1,"Une immense déception par rapport aux prétentions annoncées de ce livre. Comment peut-on prétendre que l'humanité est divisée en cinq catégories, que les gros sont comme ceci, les maigres comme cela...? Trop d'images éculées et de phrases toutes faites, le tout associé à de prétendues théories médicales, liant maladies et apparences... Du ""délit de faciès"" permanent empli de psychologie à deux balles.... Vite, fuyons !"
 24 février 2021,Thom,,2,"Je débute ce livre, j'y découvre beaucoup de références à dieu, à une vie antérieure et des problèmes n'y sont pas réglés, à la réincarnation !! Je trouve cela étrange de lier le Développement Personnel et Réincarnation.Il s'agit de croyances religieuses Personnel de l'auteure qui croise donc ces croyances avec des recherches de Psychiatre sur d'autres sujets.Donc elle fait dire ce qu'elle veut à toutes ces recherches pour que cela serve son propos.Pour le moment j'ai l'impression que l'on cherche à m'attirer dans une secte.Mais comme je débute ce livre je me donne le droit de changer d'avis.Voici un partage d'un article trouvé sur Ouest France concernant cette auteure.Lise Bourbeau, fondatrice du mouvement Ecoute ton corps, est attendue à Angers début octobre. Ce mouvement présente des risques sectaires selon la mission de lutte contre les sectes.Le mouvement Ecoute ton corps de Lise Bourbeau figure sur la liste noire des voies à risque sectaire de la Miviludes, la mission de lutte contre les sectes.Le mouvement Ecoute ton corps de Lise Bourbeau figure sur la liste noire des voies à risque sectaire de la Miviludes, la mission de lutte contre les sectes.Ouest-France  Marianne DEUMIÉ.Publié le 25/09/2013 à 18h33Attention, danger. C'est une conférence qui a attiré l'attention de la Ligue des droits de l'Homme et du Cippad, le centre d'information et de prévention sur les psychothérapies abusives de Maine-et-Loire. Une conférence apparemment anodine sur le thème Ecoute ton corps, ce qui, a priori, ne peut faire que du bien.Sauf que la conférencière est plutôt controversée. Lise Bourbeau a vendu des centaines de milliers de ses livres qui expliquent que toute maladie a une origine psychologique. Surtout, elle fait référence à la nouvelle médecine germanique du Dr. Ryke Geerd Hamers, plusieurs fois condamné pour avoir incité des patients atteints du cancer à abandonner leur traitement. Le mouvement « Ecoute ton corps » figure sur la liste noire des voies à risque sectaire de la Miviludes, la mission de lutte contre les sectes."
 12 août 2019,Mathieu89,,1,"Le thème est intéressant, avec 2 ou 3 passages qui donnent à réfléchir, ce qui est très pauvre sur 250 pages de contenu.Le reste est une mélasse informe à la croisée entre la psychologie de comptoir, le shamanisme et l’horoscope de Closer : l’auteure s’appuie sur les mécanismes pyschologiques classiques de compensation pour en tirer ses 5 blessures.Leur description est large est vague, et l’auteur ne cesse de répéter qu’on peut s’y reconnaitre totalement ou partiellement, que tout le monde peut y trouver quelque chose qui le concerne, comme un horoscope.En fin de compte elle ne livre que des problèmes dans lesquels n’importe qui peut se reconnaitre, sans apporter aucune solution réelle.Le reste est auto-promotion renvoyant vers ses autres bouquins, des copier/coller de la même conclusion à chaque chapitre (!!!) et des conseils pour inciter vos amis à acheter son livre.En quelques mots donc : thème intéressant, 2-3 passages qui font réfléchir, les 95% restants sont une mélasse de psychologie de comptoir, de shamanisme et d’horoscope, avec de la pub entre chaque. À fuir."
 19 octobre 2017,Domitille,Verifie,2,Je trouve dangereux de vendre ce genre de livres qui ne reposent sur rien de scientifique... La théorie pourrait être crédible si elle n'était pas agrémentée de blabla scandaleux.
 9 octobre 2016,koko87Client d'Amazon,Verifie,1,"nul++++++du grand n'importe quoi !pourtant je mis suis repris a plusieurs fois ( croyant avoir mal compris...mais non pas du tout !!)je regrette mes euros mis dans ce truc , c'est clair !!"
 9 février 2017,chrys45,Verifie,1,"Un tas d'inepties, des mélanges de vagues notions de psychologie et de philisophie orientale (rénicarnation), bref, un livre déprimant qui n'apporte pas grand chose de positif et constructif. heureusement qu'il n'est pas cher.."
 6 février 2021,carinel,,1,"Je suis plusieurs personnes sur youtube qui parlent des 5 blessures et donc de ce livre... j'ai donc voulu le lire aussi et... je ne m'attendais pas à ça! Je n'ai rien appris de concret en plus de ce que je savais déjà en écoutant des chaînes de développement perso, à part des élucubrations et finalement aucune ""solution"" ou piste concrète pour guérir de ses blessures. Vu les commentaires négatifs précédents, je l'ai pris comme livre gratuit sur Audible et je suis bien contente de ne pas avoir payé pour écouter ça!"
 14 mai 2017,Artefact,Verifie,1,"je ne suis pas du genre à écrire de commentaire,mais là non! pas possible de laisser passer une personne qui catalogue des genres selon sa morphologie, qui s'appuie seulement sur ses propres ressentis. il n'y a aucune références literraire mis à part un remerciement incongrus à freud etc ..en preface. ni de references à des études ou autre... bien qu'il y est une volonté de transmettre un certain bien être aux gens, ce livre ne mérite pas de figurer au sein de vos recherches personnelles!! sur la limite du sectaire !! je me risque même à dire dangereux !!"
 11 novembre 2019,Nicolas,,1,"Je ne saurais dire ce que j'ai le plus détesté dans la lecture de cette amas de mots. L'utilisation de la reincarnation comme support de raisonnement sur un comportement donné? L'affirmation qu'un foetus modifie activement sa morphologie afin de satisfaire un état psychologique donné?Le livre est une collection de généralités reminiscente des horoscopes à deux balles, mêlant psychologie, religion et interprétations comportementales de la morphologie.A éviter à tout prix."
 27 juil,CHRISTELLE L.,Verifie,4,"ce livre m'a aidé à identifier le pourquoi de certains de mes comportements et celui de certains de mes proches ! J'ai pu ainsi me pardonner et pardonner certaines blessures causées.Toutefois, il faut garder l'esprit ouvert sur certains termes utilisés, un peu spirituel,mais il y a du bon à s'adonner à cette lecture.livre à offrir c'est sûr"
 4 juin 2017,geneviève,Verifie,1,Je n'arrive pas à rentrer dans le livre... impossible à terminerJe ne suis pas convaincue par les affirmations de l'auteurs
 18 juil,Client d'Amazon,Verifie,3,je n'ai pas commence a le lire.ce livre m'a été recommandé par un ami.bien reçu en bon état.
 22 février 2017,Client d'Amazon,,1,"À peine une quarantaine de pages lues et je n'ai dejà plus envie de le finir... Certes, les livres de développement personnel sont intéressants pour la plupart mais il est bon d'avoir quand même un recul dessus pour ne pas gober n'importe quoi.D'une part, Lise Bourbeau considère la réincarnation comme un état de fait avec une théorie très simpliste et balancée comme ça, qui sort de sa propre imagination étant donné qu'il n'y a aucune thèse scientifique pour le prouver. Je n'ai pas non plus apprécié les références systématiques ou presque à ses autres livres lorsque qu'elle emploie un terme non connu par le lecteur au lieu de l'expliquer directement. Pour moi, c'est clairement du marketing caché. En gros, il faudrait qu'on achète tout ses livres pour en comprendre un.À vrai dire, je me suis sentie mal en lisant ce livre. C'est subjectif bien sûr mais la raison est simple : LB place les gens dans des cases et nous fait croire que nous avons tout simplement choisi nos expériences malheureuses que nous vivons actuellement ""à cause"" de notre vie antérieure (je ne vais pas tout détailler mais très grossièrement voilà l'idée). Ensuite, elle affirme que nous avons des choses à régler avec le parent que nous aimons le plus. Bonjour la psychologie de comptoir.Ensuite, cette manière d'attribuer des maux psychologiques à des gens rien qu'en observant leur physiologie, je trouve ça honteux ! Oh ! T'es maigre, donc tu es quelqu'un qui fuit les situations ! T'es gros ? Allez, je suis LB, donc je vais te dire EXACTEMENT quelle blessure tu as. C'est un raccourci très simpliste, je trouve. Comment peut-on écrire des inepties pareilles avec toutes les connaissances scientifiques en génétique et en médecine qui existent aujourd'hui ?Livre à fuir."
 6 mars 2015,FolleErrance,Verifie,1,"Quelle déception. Beaucoup trop ésotérique à mon goût. Louise Bourbeau dit tout et son contraire. En plus d'un amas d'explications complètement folles sur les blessures humaines, ce que j'ai trouvé très désagréable est le tutoiement de l'auteur envers son lecteur. Bref, c'est de l'argent jeté par les fenêtres. Passez votre chemin."
 19 mai 2017,CLiente,Verifie,5,Un livre très intéressant qui m'a permis de comprendre des choses bien plus rapidement que sur un divan. Je conseille sans hésiter.
 3 avril 2013,Laurent,Verifie,1,"Qu'il y ait un lien entre l'état psychologique et le corps d'une personne, je veux bien. Définir 5 blessures avec 5 types de morphologies associées, pourquoi pas.De toute façon, si vous ne collez pas à la théorie énoncée, c'est que vous n'avez pas bien réfléchi, que vous n'avez pas bien cherché ou alors que la blessure a été faite dans une vie antérieure! J'ai un peu de mal avec de type de raisonnement.En tout cas, ne cherchez pas un quelconque fondement scientifique à tout cela. Tout est basé sur l'expérience de l'auteure.De mon côté, je ne risque pas d'acheter un autre de ses livres."
 25 décembre 2016,COLETTE,Verifie,1,"La science infuse concernant le mal être des gens! à mon avis, du grand n'importe quoi bien construit sur la souffrance des personnes.Ah et puis aussi, la réincarnation existe! Ne vous posez même plus la question, Lise Bourbeau le sait. Comment? je sais pas, elle non plus probablement mais c'est un fait acquis."
 2 janvier 2014,Olive,Verifie,1,"Quand le simplisme s'allie à la bêtise! C'est véritablement affligeant! L'auteur commence par remercier Freud et Jung, un peu comme s'ils étaient ses amis (coquetterie moins futile qu'il n'y paraît), puis affirme qu'il nous faudra peut-être nous réincarner une ou plusieurs fois pour guérir de notre insatisfaction... Ca laisse rêveur... En soi, on pourrait penser qu'il s'agit d'une croyance sans danger, et que si elle aide à vivre, ma foi, y a pas mort d'homme. Mais à y regarder de plus près, il n'en est rien. Se référer, dès les premières pages, aux pères de la psychanalyse et à la réincarnation, est une manière de faire croire au lecteur non professionnel qu'on est largement au-dessus de la mêlée. Quelques précisions ensuite sur l'importance du vocabulaire, mais dont les explications sont... ""dans mes autres livres"". Personnellement, je n'aime pas les auteurs qui n'arrêtent pas d'écrire ""j'ai découvert que"", ""j'ai constaté que"" pour ne pondre que des constats ultra basiques, qui sont soit des ""enfonçages"" de portes ouvertes, soit des simplifications tellement étroites qu'elles en deviennent vraiment fausses. Bref, un pathétique mélange de psychanalyse classique, de croyance ésotérique et de pub pour soi-même."
 26 mars 2012,Le Décrypteur .,Verifie,1,"Il s'agit d'un ouvrage qui contient , perdus au milieu d'une Masse d'âneries , quelques descriptions amusantes. Les Rapports entre Psychologie et Morphologie sont totalement Fantaisistes , ainsi que les Pathologies Rattachées. La plus grande Fausse Idée de l'auteure est de rendre responsables les personnes, des conditionnements Pathologiques  éducatifs parentaux reçus, générateurs de Blessures et troubles comportementaux ultérieurs. La description de ces travers ultérieurs , artificiellement découpés en 5 Masques peut être amusante . La partie thérapeutique est sans valeur et escamotée. Au total un Livre à ne pas Acheter , car la motivation de l'oeuvre , assortie de la propagande de tous les autres livres de l'auteure , semble bien obéir à un Impératif uniquement Commercial et Lucratif."
 14 mai 2015,stella,Verifie,1,Idiot. Je l'ai imaginé et mon imagination a été plus riche. Mais je l'ai offert en charité...on ne sait jamais
 5 mai 2015,MUSICK Yvonne,Verifie,1,Je n'y ai pas trouvé d'éléments neufs et convaincants. J'ai noté beaucoup de redondances et d 'un écrit peu attrayant.
 11 juil,Ren,,1,"Comment les gens font ils pour lire ça ? Mystère.Au début de chaque chapitre, le corps et la posture et autres attributs physiques détermines nos caractères...Autant dire que c'est le flou artistique le plus total. Va savoir où te placer si tu n'es ni ""la peau sur les os"" ni ""obèses"" ni que ton dos se courbe...OHHH mais on arrête de dire et d'écrire des choses aussi absurdes là ?Qui peut lire ce livre facilement, chaque chapitre ressemble au précédent et la personne qui lit ça dira juste je me retrouve partout et nulle part.Je ne comprendrais jamais comment ce type de livre fait pour gagner en reconnaissance..."
 27 janvier 2017,JM,Verifie,5,"J'aime Lise Bourbeau, elle est d'une simplicité et d'une intelligence qui me ravient le coeur....Vous avez déjà pas mal cheminé dans le développement personnel, vous pensiez avoir tout compris de vos blessures du passé, de ce que vous aviez vécu enfant, vous pensiez que vous aviez tout pardonné ? Que c'était derrière ? Lisez ces pages, vous seriez étonné de ce que vous pourrez encore découvrir sur vous-même... je l'ai été !"
 3 mars 2019,Ilann,,1,"Je tenais à prévenir toutes les personnes qui sont intéressées par ce livre.L'auteur est une très bonne marketeuse et psychologue.Elle décrit des soi-disant ""blessures"" avec des comportements et des physiques que tout le monde à déjà eus/connus.De fait, vous vous sentez forcement concerné à un moment ou à un autre.Elle vous fait donc croire que vous avez des soi-disant ""blessures"" pour finalement vous préconisez un autre de ces livres pour les guérir.Ah oui, et si vous rejetez l'idée que vous avez des blessures : C'est normal, selon l'auteur, ca fait partie du processus, elle vous conseillera d'acheter un autre de ces livres pour vous ""guérir"".En bref, ce livre est extrêmement négatif et malsain.L'auteur vous fait croire que vous avez des problèmes en cataloguant un ensemble d'attitude que tous le monde a déjà eu dans sa vie.Surtout que les seuls conseils de l'auteur pour les guérir, c'est d'acheter un autre de ces livres.Je vous le déconseille fortement et vous invite à vous tourner vers des livres beaucoup plus positifs."
 29 septembre 2014,zab,Verifie,1,"assez déçue du contenu... Pas encore compris le but de ce livre, à part celui de se faire de l'argent"
 6 mars 2018,Vaiana64,,3,"Les 5 blessures est un classique pour toute personne se plongeant dans le développement personnel.Il fait rapidement écho et permet une prise de conscience. Néanmoins, je ne suis personnellement pas d'accord sur tous les points. C'est pourquoi je complète ma lecture par les ouvrages d'autres auteurs, pour avoir une vision plus aboutie des blessures."
 8 février 2014,ines_bendik,Verifie,1,"Je suis très ""branchée"" Développement personnel. Ce livre fait trop de généralités. Les analyses ne sont pas du tout percutantes. L'auteur explique que notre morphologie traduit notre blessure; je ne les trouve pas du tout vérifiables. Je suis très déçue par cet ouvrage. Je ne le recommanderais pas. J'ai pris beaucoup de peine à le lire jusqu'au bout."
 8 novembre 2017,Client d'Amazon,,4,"Livre très intéressant sur la relation entre le corps et l'esprit qui confirme le fait que tout est lié. il faut évidemment garder à l'esprit que la provenance d'une maladie est multifactorielle, l'auteur propose une autre piste c'est tout. A ne pas mettre entre toute les mains car les personnes non initiées vont rejeter ce livre sous couvert que ce n'est pas prouvé scientifiquement... Seul bémol a ce livre selon moi, le lien fait avec dieu. Pour moi, ce serait plutôt l'univers... il est évident que la science et la spiritualité  (et non la religion) sont liés et ne peut exister l'une sans l'autre.... allier ces deux disciplines et non les séparer serait plus intéressant...mais ça c'est un autre débat...Concernant la responsabilisation, cela peut être difficile a l'entendre, y en a toujours une et quelque soit la problématique et le trauma vécu. Tout cela dépend des vies précédentes que l'on a eu et de ce que l'âme veut réparer... cela ne veut pas dire que l'autre n'est pas responsable !  La responsabilisation amène à se pardonner soi même et d'accepter cette vie.. guérir son âme n'est pas un long fleuve tranquille.."
 25 avril 2020,Audrey,,1,"A la base le sujet des blessures est intéressant, mais je trouve que c'est trop fourre-tout comme livre. L'auteur nous balance des stéréotypes tout le long. Et dire si tu es gros alors tu es comme-ci , si tu es petit tu es comme-ça, je trouve cela d'une absurdité sans nom. De même que de faire référence à la religion, je ne suis pas certaine que cela plaise à tout le monde, cela fait quand même légèrement secte sur les bords ce bouquin.J'aime le sujet du développement personnel, j'ai déjà lu de nombreux ouvrages, mais je n'ai pas adhéré à ce livre, je ne le conseille pas et je ne comprends pas son succès."
 28 septembre 2014,plum,Verifie,1,"déjà je n'aime pas le style d'écriture, l'auteur dis ""tu ..."", elle tutoie le lecteur, comme si elle le connaissait.Puis la description est générale, on peut s'y retrouver partout, comme pour les horoscopes ...(je suis en train de lire aussi en ce moment des livres d'Alice MILLER, je les trouve beaucoup plus intéressants)"
 6 juil,Client d'Amazon,Verifie,1,Ça commence fort! Affirmation que nous avons plusieurs vies et que nous choisissons nos futurs parents en fonction des blessures passées à réparer... Suit toute une accumulation de théories fumeuses dont certaines sont basées sur l'observation des humains. Se veut scientifique mais tente de faire avaler ses propres croyances pour de la science.
 6 janvier 2016,Miss L.,Verifie,1,"Le livre est basé sur le fait qu'une blessure nous créer un physique prédéfinit (tout les gros sont masochistes, tout les gens bien proportionnés sont des dominateurs etc...), de plus il manque aussi bien d'autres aspects qui blessent les êtres humains, ils ne sont pas mentionnés, ici elle en a choisit 5 et tourne de la psychologie basique en ""astrologie""...Même pour débuter dans le self-help et le développement personnel je ne le recommande pas, ce coté astrologie et cases toutes faites risque de pousser au jugement, du style ""tu n'en as pas conscience mais si tu es maigre ça veut dire que..."" alors que c'est de la foutaise, nous sommes bien plus complexes que ça. Il y a des gros masochistes, bon vivants, dominateurs, soumis, fuyants... et des maigres masochistes! si c'était aussi simple ça ce saurait...Je ne vois pas ce que ça peut nous apporter comme information, surtout quand elle se vérifie au pifomètre, et la fin du livre n'apporte au final ni méthodes ni solutions concrètes pour se guérir."
 21 août 2017,Wel la yeyel,Verifie,2,"Ben ché pas en fait.. apres 3 lignes, la grosse feignasse que je suis na pas eu le courage d'en lire plus... y a pas d'images..va peut être falloir que j'essaye à nouveau à lire autre chose que le synopsis de ce bouquin.. je vais tenter de le mettre dans le porte livre au wc, ma fille s'y mettra peut être .."
