Date,User,Fiabilite,Score,Texte
 6 janvier 2019,DELORME,Verifie,1,"Franchement, je me suis arrêté au chapitre 1. Lier psychologie et croyance religieuse est une erreur monumentale.Selon cette femme, nous choisissons nos familles et nous nous reircarnons pour répéter les schémas de nos vies antérieures. Jusque là c'est une croyance acceptable. Jusqu'à ce qu'elle nous demande de nous dire qu'inconsciemment nous avons choisi nos familles et qu'indirectement en choisissant des pères qui nous violerons par exemple ou autres toxicités, nous l'avons choisi dans le but de nous guérir de nos autres vies similaires durant le vécu de l'actuel.Si cette croyance était populaire, ne reviendrait-elle pas à refuser le témoignage des victimes d'incestes parce que leur âme ont choisi cette famille ? Ne dirait-on pas ""c'est votre choix alors guérissez et c'est tout""Nous sommes responsables de nos choix et de ce que nous devenons mais nous ne sommes pas responsables de ce que nous avons subi.Alors oui les gens doivent se sentir mieux en lisant ce bouquin parce que le but rest l'acceptation de soi. Mais accepter ce dont on est pas responsable même si on se sent plus heureux après est un fourvoiement.Je ne conseille pas ce livre."
 15 novembre 2019,P. Greg,Verifie,4,"Lise Bourbeau, l'auteur de ces Cinq blessures qui empêchent d'être soi-même, a des convictions polémiques, notamment celles sur la réincarnation des âmes ou les maladies causées par les blessures mentales.En outre, son écriture m'a semblé par moments pesante et poussive...Pourtant, son livre m'a appris et apporté beaucoup de choses, et même aidé à mieux comprendre certains de mes fonctionnements.Le propos en est très simple; il existe cinq blessures fondamentales dont nous souffrons : le rejet, l'abandon, l'humiliation, la trahison et l'injustice.Ce n'est pas la réalité des faits qui définit la blessure ressentie, mais plus notre construction mentale : ainsi, une personne souffrant d'humiliation se sentira humiliée si son partenaire l'abandonne ou si son patron lui fait subir une injustice...Pour éviter de souffrir, nous nous construisons des masques, un pour chacune des blessures : le fuyant, le dépendant, le masochiste, le contrôlant, le rigide.Nous les portons plus ou moins souvent, en fonction de la gravité de nos blessures, mais dans tous les cas notre corps et notre comportement en sont marqués.Schématiquement, la personne souffrant d'humiliation, qui porte le masque de masochiste, aura tendance à s'habiller de vêtements qui ne l'avantagent pas et à se tacher en mangeant...La solution selon Lise Bourbeau, c'est de comprendre quels sont nos blessures, de pardonner à ceux qui nous ont blessés, mais aussi à nous-mêmes de leur en avoir voulu... et d'apprendre à s'aimer, à retirer ses masques pour devenir soi-même. Pas sûr que ce livre y suffise, mais il peut peut-être y contribuer."
 25 février 2017,Karen Payet,Verifie,2,"Un peu déçue...Lise Bourbeau décrit les ""5 blessures"" à partir du physique des gens et de leur vie antérieure (car elle est convaincu que la réincarnation existe). Tu es maigre ? Alors tu as un sentiment de rejet.Elle explique ses théories, sans ""preuves"" avec des arguments qui sont tirés par les cheveux selon mon avis.Je ne recommande pas"
 12 juin 2018,CPE,Verifie,1,Un livre à l'américaine qui fait très secte ! On pourrait croire que l'auteure a copié collé le même texte à la fin de presque tous les chapitres !
 25 avril 2018,Mod S,Verifie,1,Le contenu de ce livre est complètement délirant. Je ne vois pas comment il peut avoir autant de commentaires positifs.
 28 octobre 2016,Client d'Amazon,Verifie,1,"J'ai trouvé le thème du livre intéressant mais je n'ai pas réussi à rentrer dedans. Je ne suis pas convaincue par ce qu'affirme l'auteure, les descriptions restent très larges, un peu à la manière des horoscopes. Les solutions ne sont pas très détaillées."
 30 décembre 2017,lounatheo,Verifie,5,"Ce livre est une révélation. Je n’au Jamais pu croire que l’aspect physique pouvait à se point être le reflet de nos blessures...et pourtant, je lis la blessure qui correspond à mon physique et j’ai L’impression qu’elle parle de moi !"
 23 septembre 2017,Sandrou,Verifie,5,"livre parfait pour commencer à se connaître et à identifier les blessures qui nous font souffrir à un prix abordable. Clair et explicite il est à lire et à relire. seul bémol, peut-être un peu léger sur la guérison de ces blessures mais l'auteur a fait un autre livre à ce sujet il ne souhaitait donc stratégiquement pas tout dévoiler...."
 24 avril 2019,Client d'Amazon,Verifie,1,"Livre intéressant pour quelques lignes disséminées dans l'ensemble de l'ouvrage et qui décrivent les différents profils.Pour le reste, ce type de livre est à fuire!Rien ne justifie les affirmations grotesques de l'auteur, comme affirmer que toutes les personnes humiliées sont en surpoids, ou que toutes les personnes rejetées ont de petits yeux enfoncés dans leurs orbites! J'ai cru lire un ouvrage sur la phrénologie!Aucune base scientifique si ce n'est les ""nombreuses observations"" de l'auteur et un ensemble disparate de lieux communs et de généralités. Je déconseille!"
 7 décembre 2018,Stéphane Bourriaux,Verifie,1,"Apparement , l'idées des Blessures évoquées ne sont même pas de l'auteure mais d'un psychanalyste américain. Ensuite, même si l'idée de base est bonne, attribuer des physiques ou des problèmes de santé en fonction du type de blessure que l'on a subit relève plus (selon moi) du charlatanisme que du réel développement personnel. C'est la première fois de ma vie que je jette un livre à la poubelle. Je ne me suis pas rendu à la deuxième blessure."
 5 août 2018,Client d'Amazon,Verifie,4,"Alors ok il est vrai que je me suis reconnue dans certains masques et qu’ainsi ce livre aide à ce rendre compte de certaine choses.Cependant je trouve que l’auteur mélange tout, on ne sait plus quelle blessure on a vécue, quel masque nous décrit vraiment et qu’est-ce-que l’on doit faire pour s’améliorer à la fin du livre ! Et surtout je ne parlerai pas de blessures mais plutôt de fausses croyances nées dans l’enfance, il ne faut pas non plus tout dramatiser, à la fin du livre on est encore plus malheureux qu’au début, la prise de conscience fait mal et n’aide pas vraiment ici...!"
 4 janvier 2019,Al.gdo,Verifie,1,"En théorie, ce livre est une super idée. Les différentes blessures sont pas mal détaillées et cataloguées. Le problème c'est qu'il est impossible de se retrouver dans une blessure, nous sommes tous un mélange de plusieurs (Je l'ai prêté à plusieurs personnes de ma famille et nous avons tous fait le même constat). Et en admettant que nous ayons ciblé notre ou nos blessures, pas de piste concrète pour y remédier ou alors trop vague et trop théorique. Grosse déception pour ma part."
 12 avril 2018,Heavena12,Verifie,5,"Je l'ai lu en 1 journée, tellement la lecture est fluide et agréable. Très digeste et m'a permis d'en apprendre énormément sur moi même. Les termes utilisés sont clairement expliqués au début du livre et cohérent avec l'approche de l'auteur. Ce qui fait qu'une personne croyante peu importe sa confession ne se sentira pas offusqué. Je vous le recommande vraiment, c'est un excellent rapport qualité prix."
 10 mai 2017,anonyme,Verifie,5,"une formidable découverte sur soi, perturbant parfois mais vaut vraiment le coup.permet de comprendre beaucoup de choses et de guérir ces fameuses blessures"
 4 mars 2019,Houdin sandrine,Verifie,1,On m’avait conseillé ce livre!  Mais je n’ai lu que 20 pages car j’ai trouvé ça absurde! Du moins il faut croire ce qu’elle dit et moi je pense que oui nous avons des blessures en nous mais je n’ai pas Du tout aimé comment l’aiteur Décrit les blessures par le physique! Je pensais trouver quelque chose qui pouvait aider et je le trouve démoralisant!Elle parle de réincarnation! Bref ce n’est pas ma croyance à moi mais peut être que certaines personnes peuvent y croire et s’y retrouver!
 14 août 2018,Helene,Verifie,1,"Je n'ai pas apprécié la lecture de ce livre. On lit 5 portraits stéréotypés dans lesquels on est sensé se reconnaître ? Et ensuite, aucune piste pour progresser. Très déçue par ce livre recommandé par de nombreuses personnes."
 19 avril 2020,J'aime lire,Verifie,2,"Franchement je lis beaucoup j'adore ça et ayant un problème d'estime de moi qui m'empêche de me lancer et d'avancer professionnellement, j'ai voulu savoir d'où  cela pouvait venir et comment pallier à ce problème car je trouve que je ne m'impose pas, que je me met beaucoup en retrait et je n'ose pas me lancer de peur d'échouer ce qui me joue des tours. Sur le moment je l'ai trouvé très intéressant mais après coup je me suis senti très mal. Je trouve que le livre choisit ses mots et ses situations afin que nous puissions nous identifier à lui et nous rendre modulable sur notre propre conduite et notre conduite avec notre entourage. J'ai l'impression que le livre dirige notre façon de voir les choses et pas du tout dans le bon sens. Je me suis senti coupé du monde réel (blessures lié au physique, âme, réincarnation, c'est nous qui choisissons nos familles qui peuvent nous faire du mal par la réincarnation...).  Vraiment trop bizarre. Je ne le conseille pas surtout pour les personnes qui se sentent très mal et qui sont en quête d'identité. Je trouve la pensée du livre sectaire et dangereuse."
 25 novembre 2017,Mady,Verifie,5,"Colis arrivé rapidement et livre en bon état. Pas d’écornures à déplorer, merci ! Ce livre est une petite merveille, mais attention après cette lecture vous serez obligé de mieux vous connaitre et donc de passer à l'action pour améliorer votre état émotionnel. Plus d’excuses... mince ;)"
 16 février 2021,Frederic,Verifie,1,"Je suis déçu qu'Amazon ait mis ce livre comme un best seller quant on lit les controverses de l'auteur qui mélange psychologie et religieux...D'ailleurs un rapport de commission d'enquête du 05/12/2012 ""Dérives thérapeutiques et dérives sectaires : la santé en danger"" met en garde contre cette personne.Un extrait de cette personne qui parle de l'Alzeihmer : ""Cette maladie est un moyen utilisé pour fuir la réalité du présent. La personne atteinte de cette maladie a été souvent du genre à s'occuper des autres. Elle utilisait beaucoup sa mémoire pour effectuer les tâches du quotidien, s'immergeant dans celles-ci pour essayer d'oublier les incidents du passé qui l'ont fait souffrir...""Abject. Je vous passe son opinion sur le cancer du sein...Merci à Amazon de revoir leurs algorithmes à ce niveau car chercher un bouquin de psychologie et finir sur un ouvrage de mauvaise foi mélangeant tout... j'ai dû jeter ce livre qui peut davantage nuir que guérir."
 27 juin 2019,Charles-Albert Barou,Verifie,1,"Une espèce de soupe simpliste, écrit dans un style dépourvu d'intérêt.Les fins des différents chapitres sont littéralement copiées-collées, on ne sent pas beaucoup de respect pour le lecteur.Si vous cherchez à améliorer votre relation à vous-même et aux autres, il y a beaucoup d'autres livres à lire."
 29 octobre 2017,Lyla,Verifie,4,Un livre décrivant les caractéristiques physiques liés aux blessures émotionnelles dominant chez un individu. L'auteur donne également les remèdes.... Intéressant comme approche...on devient plus observateur ...après à ne pas prendre au pied de la lettre mais c'est intéressant.
 15 février 2021,Simon Vandereecken,Verifie,1,"En étant le plus honnête possible, ce livre est le plus gros ramassis d'absurdités que j'ai jamais eu l'occasion de lire.Démarrant sur des relents de phrénologie assimilant toute typologie physique à des traits de caractères définissant définitivement une personnalité sur mode de ""le corps ne ment jamais"", en passant par une volonté de se targuer ""d'années d'expérience de recherche scientifique"" (alors que l'entièreté du livre baigne dans un courant new age que ne rebuterait pas n'importe quel adepte d'une secte naturaliste) ainsi qu'une compilation d'effets Barnum qui ferait pâlir de jalousie l'astrologie (chacune des blessures citées dans le livre se retrouvant dans n'importe quel parcours de vie), je ne comprends absolument pas l'intérêt, l'intelligence ou quoi que ce soit que l'on puisse trouver à ce livre.Rajoutez à cela que l'auteur ne fait que renvoyer constamment à ses autres ouvrages (sans doutes du même acabit) ou à ses formations (pour ceux désireux à mon avis de se ruiner), tout en ne proposant au final que très peu de solutions pour s'attaquer à ces ""blessures qui empêchent d'être soi-même"" (comment s'y attaquer occupe à peine les 20 dernières pages du livre, c'est dire), on est dans une vaste escroquerie se drapant d'oripeaux scientifiques aucunement crédibles.Ne me reste plus qu'à demander à l'ami qui m'a conseillé ce livre d'éviter d'autres conseils si cela suit le même acabit."
 26 février 2021,Cins_Nac,Verifie,3,"✅J'ai apprécié la lecture et je m'y suis reconnue à de nombreux passages. Cependant...❌ Le côté spirituel voire religieux me dérange beaucoup. Ça parle de vie antérieure, de Dieu (même s'il fait rapport à notre vrai MOI), de vie sur terre, etc. Les blessures seraient la avant notre naissance et notre âme viendrait sur terre pour régler ses blessures. Bon. Ce qui m'intéressait à l'achat c'était le côté psychologique, scientifique, et la je trouvais que ça partais un peu loin pour moi dans le spirituel. C'est dommage car le fond était vraiment intéressant et crédible (les 5 blessures, les comportements, les formes du corps, etc). Je voulais voir d'autres de ses ouvrages mais je vois que c'est dans le même chemin et qu'elle y mentionne même Jésus (écoute ton corps) Je n'ai absolument rien contre la religion, mais ce n'est pas ce que je recherche,et cela devrait être plus explicite dans le descriptif.Pour terminer, je ne vois pas comment ce livre peu aider quiconque, il n'y a pas de solutions dans ce livre. La pub pour ses autres livres et ses formations n'ont rien faire aussi la dedans.Je ne conseille pas."
 9 décembre 2020,Lionne,Verifie,4,"Si effectivement vous n’avez aucune connaissance sur le concept du Karma ni des vies antérieures, vous allez vous sentir tenu pour responsable d’un point de vu négatif. Vous n’allez pas saisir la puissance du livre.Si vous maîtrisez un minimum ce sujet, vous pouvez le lire sans crainte. Sautez dessus même.Il est d’une extrême puissance et fait réaliser et Rémonter des choses jusque là nier.Effectivement l’ego est vraiment défensif face à de telles vérités.Vous verrez facilement pour les autres au début.Vous pouvez ne pas vous sentir concerné en le lisant... a cause de l’ego défensif... mais il n’est que rarement possible que vous reveniez vous réincarner, si vous n’avez pas une blessure spécifique à régler.Il faut dissocier ce que vous pouvez reproduire ou chercher inconsciemment, de l’absence de culpabilité des atrocités qu’on peut avoir vécues biensur. Mais si vous comprenez le principe karmique, vous comprendriez que toute dette est payé et que la guérison ne passe que par vous et non pas ceux qui vous ont causé du tort."
 15 mars 2019,elimacline,Verifie,3,"Le livre est assez troublant, il décrit de manière corrélée et assez surprenante les traits de caractère, la personnalité, le comportement et le physique de personnes  ayant subit certaines blessures dans leur enfance. Et d'un autre côté, l'auteur lie ces blessures à des concepts plus ésotériques comme la réincarnation de l'âme. Un livre instructif, agréable à lire mais un peu déroutant de par la superposition de certaines descriptions criantes de vérité, de concepts lié au spiritisme et de psychosociologie."
 10 mars 2019,Dim,Verifie,5,"J'ai bien aimé le concept du titre et le développement ne déçoit pas bien qu'à mon stade je n'est rien appris de complètement nouveau mais j'ai pu faire le point et j'ai obtenu deq confirmations sur ma progression déjà bien avancée dans ce domaine. Par contre je prêterai ce livre avec plaisir aux amis qui en auront besoin car il les conseils qu'il contient sont clairs et tout à fait réalistes sur le moyen ou le long terme. Car la démarche pour aller mieux est un long cheminement sans coup de baguette magique. Mais on peut compter sur un résultat je pense.À posséder à son chevet, et à consulter quotidiennement.En effet : aller bien est l'œuvre d'une vie.et est la seule tâche qui vaille la peine de s'investir sérieusement et passionnément. Tout le reste est parfaitement futile et périssable.""Aller bien"" et être en paix avec soi, son histoire, ses choix et sa propre perqonnalité n'a pas de prix, hormis celui de l'effort, avec l'Amour de la Vie Elle-même.Et n'oubliez pas de remercier tout le temps la Vie (ou l'Univers, ou Dieu ou son Guide intérieur...) afin d'obtenir de l'aide en permanence. C'est là le ""secret"". Auquel cas, ce livre ne vous servirait à rien.Enjoy Life and love it."
 31 mars 2021,Chichi,Verifie,1,"Ce livre m'a laissée très dubitative.J'ai trouvé que les concepts ne manquaient pas d'être intéressants dans l'absolu.Seulement, où sont les sources de ces vérités annoncées ? De ce que j'ai compris, rien d'autre que la grande expérience de l'auteure au cours de ses ateliers. Pas d'études, pas de statistiques. Rien que des vérités absolues qu'il nous faut accepter.Alors évidemment, on se cherche un peu dans les différents descriptifs et comme on se voit un peu partout où presque, l'ouvrage nous dit qu'il faut se fier à la description physique car le corps ne ment pas. Sauf que si quelqu'un fait de l'halterophilie, il toujours selon l'auteure, il/elle modifie son corps et rend cette lecture plus difficile mais on peut quand même deviner...Enfin, les explications ne m'ont pas parues convaincantes. Et 5 blessures, faut il y comprendre qu'il n'y a que 5 types de personnalités différentes ? Car des blessures, je ne pense pas révolutionner une idée en disant que tout le monde en a...Quoiqu'il en soit, ce livre n'a pas fait écho chez moi, et je trouve qu'un ouvrage si peu sourcé et étayé ne peut que nuire à la crédibilité de la discipline en elle même (de développement personnel).Après, on aime ou pas le choix narratif de parler au lecteur à la 2de personne du singulier. En ce qui me concerne, je trouve que cela n'apporte rien."
 27 novembre 2018,Eli,Verifie,1,"Traverssant une période difficile, on m'a conseillé ce livre, je m'attendais a y trouver des réponses, certes on en trouve mais peut être pas autant que l'on en espère en lisant les avis des uns et des autres. ... Bof ...."
 1 juil,Riri,Verifie,2,"J'ai lu les livres de Moussa Nabati et du coup ce livre n'a pas été ultra spectaculaire. Je sais que tout le monde en parle de façon élogieuse, soit pour mettre l'auteur sur un pied d'estale, soit pour faire comme les autres à savoir ne pas être trop critique, soit ils ont lu ce livre en 1er dans le développement personnel.Je n'ai pas accroché quand l'auteure s'adresse au lecteur en le tutoyant. On dirait une maîtresse qui parle à un enfant voir pire une personne qui parlerait à une cruche, que je ne suis pas.Je ne recommanderai pas ce livre pour les raisons évoquées."
 20 juil,Laura,Verifie,1,Beaucoup trop perché pour moi! Je voulais un truc un peu feel-good et j’ai l’impression de lire le tract d’une secte
 12 janvier 2020,totor1612,Verifie,5,"Un livre que chacun devrait lire avant d'aller consulter un psychologue, psychanalyste, hypnothérapeute ou tout autre thérapeute.Un ouvrage qui  parle à vous même, qui vous oblige à vous recentrer et vous écoutez en votre fort intérieur.Une formidable façon de voir qui l'on est vraiment, pour qu'elles raisons nous agissons ainsi avec nous même et avec les autres.Une sorte de thérapie personnelle qui vous explique comment vous êtes devenus ce que vous êtes et pourquoi vous souffrez au quotidien d'un mal que vous vous êtes créé.Un merveilleux livre à lire et relire autant de fois nécessaire pour arriver à s'accepter et se permettre de s'autoriser à guérir avec Amour."
 7 juin 2015,Sam,Verifie,3,"J'ai beaucoup aimé lire ce livre, que j'ai d'ailleurs lu en 2 jours seulement.Mais l'auteur n'a pas la science infuse et si certaines choses semblent être vraies, je reste plus sceptique face à d'autres.  Je ne m'attendais notamment pas à ce que l'auteur avance une idée de réincarnation qui empêche à ce livre d'être universel.Le bon est à prendre, le mauvais à laisser. Mais je recommande tout de même à chacun de lire ce livre que, selon moi, nous permet d'être plus souple avec autrui et avec nous-même. Ce livre intéressera ceux qui sont en quête de sens."
 17 septembre 2017,ALE60620,Verifie,4,"J'ai été très surprise de découvrir que notre morphologie était le reflet de nos blessures, et bien d'autres choses. J'ai aimé ce livre, je pense que tout n'est pas à prendre mais il est à lire."
 12 décembre 2020,Maman91,Verifie,3,"J’ai bien aimé ce livre mais certains points me laissent perplexes. Comme le fait de rattacher un type de physique à une blessure.. alors bien sûr des fois il y a des façons de se tenir etc qui en disent long mais à ce point je ne suis pas sure, je ne pense pas que ce soit une science exacte. Je n’ai pas du tout aimé l’histoire selon laquelle avant de naître l’âme d’un enfant choisit sa famille.. mais bien sûr 🙄. Sinon le descriptif des blessures est intéressant et pour ma part je me reconnais dans plusieurs."
 24 février 2019,LuLu,Verifie,1,Déception total. J'ai arrêté de lire ce livre au 1/4. Je ne m'attendais pas vraiment à ça. J'espérais avoir des réponses et de l'aide mais pas du tout. Je ne le recommande à personne.
 26 février 2020,M. Denis Billo,Verifie,3,"On est au niveau presque zéro de la psychologie de base...Les gens sont classés par leur forme, je trouve ça dangereux !L'idée des blessures est peut-être cohérente, mais nous avons tous toutes les blessures en nous et vraiment tenter de faire aller mieux le mental à l'aide du mental, les occidentaux croient en cela, mais c'est bien dommage, très limité et peu convaincant..."
 23 août 2019,Melle P,Verifie,5,"Il y a des livres dont la portée est immense parce qu'elle nous permet à la fois de mieux nous comprendre et aussi de mieux comprendre les gens qui nous entourent.Ce livre en fait partie. Au tout début les premières pages je n'ai pas aimé, en bonne française (lol) j'ai eu du mal avec le tutoiement direct qui donnait une sensation de familiarité un peu étrange.Mais passé cela, on dévore le livre et les description physiques sont très pertinentes. Les 5 types de profils servent de référence lorsque l'on cherche à comprendre nos propres réactions.c'est un outil indispensable de développement personnel."
 1 février 2020,Grand lecteur,Verifie,3,"Livre au contenu très inégal, plusieurs idées sont très intéressantes.Ce qui me gêne, c'est le fonctionnement complètement fermé, voire sectaire, du raisonnement. Même si l'auteur s'en défend, elle présente ses idées comme la vérité incontestable et absolue, et toute critique ou remise en question de sa pensée est automatiquement assimilée à un mécanisme de défense.Souvent éclairant, vaut la peine d'être lu, en gardant un esprit critique."
 15 juin 2019,ARGOIN Christophe,Verifie,5,"Beaucoup d'informations données concernant le type de posture et la manière de s'exprimer de chacun. Nous portons des masques et l'idée est de reconnaître ces blessures, de les faire tomber puis de guérir car chaque posture décrit une blessure ancienne non résolue à laquelle on s'est identifié. Soigner et guérir l'enfant intérieur, c'est le mot d'ordre. Ça nous on dit long sur nous même et notre entourage."
 3 décembre 2020,Louisiem,Verifie,4,"Il est facile de découvrir ou de se familiariser avec les 5 blessures grâce à ce livre.L'écriture ou les exemples cités n'ont rien d'exceptionnels car l'auteur n'a pas de don pour l'écriture, se met souvent en scène (c'est récurrent chez elle à travers ses autres ouvrages) et elle presque dure avec certains profils.Mais au final tout ca n'a aucune inportance car ce livre reste une approche convenable et compréhensible pour intégrer le sujet. Pour ma part, ça m'a permis de travailler sur moi-même."
 6 mai 2017,Amazon Customer,Verifie,5,Je recommande ce livre qui apporte des clés de compréhension de soi même et de nos êtres chers. Nous ne sommes que le produit de nos blessures passées
 21 juin 2018,Client d'Amazon,Verifie,4,Le livre est vraiment bien il donne une perspective différente aux personnes qui nous entourent et à nous. Par contre la traduction est horrible. Il faut souvent relire à plusieurs reprises pour comprendre la traduction et il y a quand même beaucoup de répétitions. Du coup la lecture n’est pas fluide. Quel dommage.
 7 septembre 2020,RONY74,Verifie,4,"J'ai mis 4 étoiles car j'avoue avoir sauté quelques passages, surtout vers la fin. Je ne suis pas une grande lectrice, et pour moi ce fut assez compliqué d'arriver au bout, d'où ces 4 étoiles. Maintenant, je pense qu'il me sera nécessaire de revenir sur certains chapitres et de prendre des notes afin de déterminer mes blessures, bien que je l'ai déjà en partie déterminée. Pour terminer, je tiens à  remercier Lise pour cet ouvrage, et je pense que la lecture d'autres de ses ouvrages suivra."
